{
  "agent_id": "orchestrator-state",
  "agent_version": "1.0",
  "run_id": "2026-05-07T06-05-00Z",
  "period": {
    "from": "2026-05-06T14:00:00Z",
    "to": "2026-05-07T05:00:00Z"
  },
  "sources": [
    {
      "agent_id": "monitor-rada-bills",
      "artifact_path": "runs/monitor-rada-bills/2026-05-07T06-00-00Z.json",
      "run_id": "2026-05-07T06-00-00Z",
      "items_count": 0,
      "had_errors": false
    },
    {
      "agent_id": "monitor-kmu",
      "artifact_path": "runs/monitor-kmu/2026-05-07T06-00-30Z.json",
      "run_id": "2026-05-07T06-00-30Z",
      "items_count": 0,
      "had_errors": false
    },
    {
      "agent_id": "monitor-nbu",
      "artifact_path": "runs/monitor-nbu/2026-05-07T06-01-00Z.json",
      "run_id": "2026-05-07T06-01-00Z",
      "items_count": 0,
      "had_errors": false
    }
  ],
  "items": [],
  "stats": {
    "items_total": 0,
    "items_by_source": {
      "monitor-rada-bills": 0,
      "monitor-kmu": 0,
      "monitor-nbu": 0
    },
    "sources_with_errors": [],
    "errors": []
  }
}
